{
  "$schema": "https://json-schema.org/draft/2020-12/schema",
  "$id": "https://schemas.socioprophet.org/sociosphere/governance/execution-receipt.v0.1.schema.json",
  "title": "ExecutionReceipt v0.1",
  "description": "Hashable record proving what actor, capability, workflow, tool, agent, or infrastructure path executed a governed action.",
  "type": "object",
  "additionalProperties": false,
  "required": ["schemaVersion", "recordType", "receiptId", "actionRef", "executor", "execution", "artifactRefs", "replay", "provenance", "integrity"],
  "properties": {
    "schemaVersion": { "const": "governance.execution-receipt.v0.1" },
    "recordType": { "const": "ExecutionReceipt" },
    "receiptId": { "type": "string", "minLength": 1 },
    "actionRef": { "type": "string", "minLength": 1 },
    "executor": {
      "type": "object",
      "additionalProperties": false,
      "required": ["executorId", "executorKind", "capabilityRef"],
      "properties": {
        "executorId": { "type": "string", "minLength": 1 },
        "executorKind": { "type": "string", "enum": ["human", "agent", "service", "workflow", "ci", "runtime"] },
        "capabilityRef": { "type": "string", "minLength": 1 },
        "runtimeRef": { "type": "string", "minLength": 1 }
      }
    },
    "execution": {
      "type": "object",
      "additionalProperties": false,
      "required": ["status", "startedAt"],
      "properties": {
        "status": { "type": "string", "enum": ["succeeded", "failed", "denied", "cancelled", "review_required"] },
        "startedAt": { "type": "string", "format": "date-time" },
        "completedAt": { "type": "string", "format": "date-time" },
        "decisionRef": { "type": "string", "minLength": 1 },
        "policyDecisionRef": { "type": "string", "minLength": 1 },
        "environmentRef": { "type": "string", "minLength": 1 }
      }
    },
    "artifactRefs": {
      "type": "array",
      "minItems": 1,
      "items": { "type": "string", "minLength": 1 }
    },
    "evidenceBundleRef": { "type": "string", "minLength": 1 },
    "replay": {
      "type": "object",
      "additionalProperties": false,
      "required": ["replayable"],
      "properties": {
        "replayable": { "type": "boolean" },
        "replayArtifactRef": { "type": "string", "minLength": 1 },
        "graphSnapshotRef": { "type": "string", "minLength": 1 },
        "determinismClass": { "type": "string", "enum": ["deterministic", "bounded_nondeterministic", "synthetic", "not_replayable"] }
      }
    },
    "provenance": {
      "type": "object",
      "additionalProperties": false,
      "required": ["createdBy", "createdAt", "sourceRepo", "nonSecret"],
      "properties": {
        "createdBy": { "type": "string", "minLength": 1 },
        "createdAt": { "type": "string", "format": "date-time" },
        "sourceRepo": { "type": "string", "minLength": 1 },
        "sourceCommit": { "type": "string", "minLength": 1 },
        "nonSecret": { "type": "boolean" }
      }
    },
    "integrity": {
      "type": "object",
      "additionalProperties": false,
      "required": ["contentDigest"],
      "properties": {
        "contentDigest": { "type": "string", "pattern": "^sha256:[a-f0-9]{64}$" },
        "signatureRef": { "type": "string", "minLength": 1 },
        "hashAlgorithm": { "type": "string", "enum": ["sha256"] }
      }
    }
  }
}
